{
    "$schema": "http://json-schema.org/draft-07/schema#",
    "$id": "event.schema.json",
    "title": "Event Seed Schema",
    "description": "JSON schema for Event entity seeds",
    "type": "object",
    "properties": {
        "$schema": {
            "type": "string"
        },
        "id": {
            "type": "string",
            "description": "Event ID (UUID)"
        },
        "slug": {
            "type": "string",
            "description": "Event slug"
        },
        "name": {
            "type": "string",
            "description": "Event name"
        },
        "summary": {
            "type": "string",
            "description": "Event summary"
        },
        "description": {
            "type": "string",
            "description": "Event description"
        },
        "lifecycleState": {
            "type": "string",
            "enum": ["DRAFT", "ACTIVE", "ARCHIVED"],
            "description": "Lifecycle state of the event"
        },
        "media": {
            "$ref": "common.schema.json#/definitions/media"
        },
        "category": {
            "type": "string",
            "enum": [
                "MUSIC",
                "CULTURE",
                "SPORTS",
                "GASTRONOMY",
                "FESTIVAL",
                "NATURE",
                "THEATER",
                "WORKSHOP",
                "OTHER"
            ],
            "description": "Event category"
        },
        "date": {
            "type": "object",
            "properties": {
                "start": {
                    "type": "string",
                    "format": "date-time",
                    "description": "Event start date"
                },
                "end": {
                    "type": "string",
                    "format": "date-time",
                    "description": "Event end date"
                },
                "isAllDay": {
                    "type": "boolean",
                    "description": "Whether event is all day"
                },
                "recurrence": {
                    "type": "string",
                    "enum": ["DAILY", "WEEKLY", "MONTHLY", "YEARLY"],
                    "description": "Event recurrence type"
                }
            },
            "required": ["start"],
            "additionalProperties": false
        },
        "authorId": {
            "type": "string",
            "description": "Author user ID"
        },
        "locationId": {
            "type": "string",
            "description": "Related location ID"
        },
        "organizerId": {
            "type": "string",
            "description": "Related organizer ID"
        },
        "pricing": {
            "type": "object",
            "properties": {
                "isFree": {
                    "type": "boolean",
                    "description": "Whether the event is free"
                },
                "price": {
                    "type": "number",
                    "minimum": 0,
                    "description": "Base price"
                },
                "priceFrom": {
                    "type": "number",
                    "minimum": 0,
                    "description": "Price from"
                },
                "priceTo": {
                    "type": "number",
                    "minimum": 0,
                    "description": "Price to"
                },
                "pricePerGroup": {
                    "type": "number",
                    "minimum": 0,
                    "description": "Price per group"
                },
                "currency": {
                    "type": "string",
                    "enum": ["ARS", "USD"],
                    "description": "Price currency"
                }
            },
            "required": ["isFree"],
            "additionalProperties": false
        },
        "contact": {
            "$ref": "common.schema.json#/definitions/contactInfo"
        },
        "visibility": {
            "type": "string",
            "enum": ["PUBLIC", "PRIVATE", "RESTRICTED"],
            "description": "Event visibility"
        },
        "isFeatured": {
            "type": "boolean",
            "description": "Whether event is featured"
        },
        "tagIds": {
            "type": "array",
            "items": {
                "type": "string"
            },
            "description": "Array of tag IDs (UUIDs)"
        },
        "seo": {
            "$ref": "common.schema.json#/definitions/seo"
        }
    },
    "required": [
        "id",
        "slug",
        "name",
        "summary",
        "category",
        "date",
        "authorId",
        "visibility",
        "isFeatured",
        "lifecycleState"
    ],
    "additionalProperties": false
}
